"","area","Family","TaxonName","iNatTaxon","HJ_comment","FPNW_note","critical_comments","reviewed","iNat_taxon"
"342","ssi","Fabaceae","Trifolium arvense","Trifolium arvense","Dry roadside verges.","","","","Trifolium arvense"
"343","ssi","Fabaceae","Trifolium campestre","Trifolium campestre","Lawns, roadsides, waste places.","","","","Trifolium campestre"
"344","ssi","Fabaceae","Trifolium dichotomum","Trifolium dichotomum","Grassy, south facing bluffs","","","","Trifolium dichotomum"
"345","ssi","Fabaceae","Trifolium dubium","Trifolium dubium","Lawns, pasture and waste grounds throughout.","","","","Trifolium dubium"
"346","ssi","Fabaceae","Trifolium hybridum","Trifolium hybridum","Roadsides, pasture, fields,","","","","Trifolium hybridum"
"347","ssi","Fabaceae","Trifolium incarnatum","Trifolium incarnatum","iNaturalist report Musgrave Rd 2019","","","","Trifolium incarnatum"
"348","ssi","Fabaceae","Trifolium microcephalum","Trifolium microcephalum","Grassy bluffs and ledges.","","","","Trifolium microcephalum"
"349","ssi","Fabaceae","Trifolium microdon","Trifolium microdon","Bluffs, slopes on sandy or rocky soil.","","","","Trifolium microdon"
"350","ssi","Fabaceae","Trifolium oliganthum","Trifolium oliganthum","Bluff, grassland on dry, rocky soils.","","","","Trifolium oliganthum"
"351","ssi","Fabaceae","Trifolium pratense","Trifolium pratense","Moist roadsides, lawn, meadows.","","","","Trifolium pratense"
"352","ssi","Fabaceae","Trifolium repens","Trifolium repens","Lawns, pastures, roadsides, waste areas.","","","","Trifolium repens"
"353","ssi","Fabaceae","Trifolium striatum","Trifolium striatum","FL Long Harbour ferry terminal.","","","","Trifolium striatum"
"354","ssi","Fabaceae","Trifolium subterraneum","Trifolium subterraneum","FL Cusheon Lake 2002.","","","","Trifolium subterraneum"
"355","ssi","Fabaceae","Trifolium variegatum","Trifolium variegatum","Grassy banks just above sea, grassy bluffs.","","","","Trifolium variegatum"
"356","ssi","Fabaceae","Trifolium willdenovii","Trifolium willdenovii","Bluff, grassland on dry, rocky soils.","","","","Trifolium willdenovii"
"357","ssi","Fabaceae","Trifolium wormskioldii","Trifolium wormskioldii","TRA Ganges, HJ Booth Canal.","","","","Trifolium wormskioldii"
"358","ssi","Fabaceae","Ulex europaeus","Ulex europaeus","Waste ground, shoreline banks, disturbed ground on ridges.","","","","Ulex europaeus"
"359","ssi","Fabaceae","Vicia americana","Vicia americana","Dry, open woods.","","","","Vicia americana"
"360","ssi","Fabaceae","Vicia cracca","Vicia cracca","Roadsides and waste ground.","","","","Vicia cracca"
"361","ssi","Fabaceae","Vicia hirsuta","Vicia hirsuta","Roadsides, disturbed ground.","","","","Vicia hirsuta"
"362","ssi","Fabaceae","Vicia lathyroides","Vicia lathyroides","Long, Musgrave Landing. FL Mt Tuam 1999, HLR Ruckle Park 1999.","","","","Vicia lathyroides"
"363","ssi","Fabaceae","Vicia nigricans var. gigantea","Vicia gigantea","Open forest and gulleys near salt water, wet brackish or saline places.","","","","Vicia gigantea"
"364","ssi","Fabaceae","Vicia sativa","Vicia sativa","Roadsides, disturbed ground.","","","","Vicia sativa"
"365","ssi","Fabaceae","Vicia tetrasperma","Vicia tetrasperma","Roadsides, cultivated ground, weedy areas.","","","","Vicia tetrasperma"
"366","ssi","Fabaceae","Vicia villosa","Vicia villosa","Roadside, fields, ddisturbed areas.","","","","Vicia villosa"
"367","ssi","Fagaceae","Quercus garryana","Quercus garryana","Exposed bulffs, grassy slopes and islets. All islands. Never in mixed forest as on Saanich Peninsula.","","","","Quercus garryana"
"368","ssi","Gentianaceae","Centaurium erythraea","Centaurium erythraea","Farm fields, meadows.","","","","Centaurium erythraea"
"369","ssi","Geraniaceae","Erodium cicutarium","Erodium cicutarium","Disturbed ground.","","","","Erodium cicutarium"
"370","ssi","Geraniaceae","Geranium bicknellii","Geranium bicknellii","ICS location? MCM collection?","","","","Geranium bicknellii"
"371","ssi","Geraniaceae","Geranium carolinianum","Geranium carolinianum","Dry roadsides, dirt roads. HJ Deadman Islet 1996.","","","","Geranium carolinianum"
"372","ssi","Geraniaceae","Geranium lucidum","Geranium lucidum","FL North Beach Rd, grassy roadside 2010. First BC record of this invasive species.","","","","Geranium lucidum"
"373","ssi","Geraniaceae","Geranium molle","Geranium molle","Roadside, lawns, waste places, open grassy bluffs","","","","Geranium molle"
"374","ssi","Geraniaceae","Geranium purpureum","Geranium purpureum","Rose Reynolds Rd iNaturalist report 2020. No herbarium records for area found.","","","","Geranium purpureum"
"375","ssi","Geraniaceae","Geranium robertianum","Geranium robertianum","Many iNaturalist reports for area.","","","","Geranium robertianum"
"376","ssi","Grossulariaceae","Ribes bracteosum","Ribes bracteosum","Thompson Sunset Drive iNaturalist report 2019.","","","","Ribes bracteosum"
"377","ssi","Grossulariaceae","Ribes divaricatum var. divaricatum","Ribes divaricatum divaricatum","Moist, open woods and thickets; occasional throughout.","","","","Ribes divaricatum divaricatum"
"378","ssi","Grossulariaceae","Ribes lacustre","Ribes lacustre","Shady lake edges, muddy places, damp forest floor.","","","","Ribes lacustre"
"379","ssi","Grossulariaceae","Ribes lobbii","Ribes lobbii","TRA St Marys Lake, Cusheon Lake 1955. Calder Mt Maxwell 1961. Common along roadside Mt Tuam area.","","","","Ribes lobbii"
"380","ssi","Grossulariaceae","Ribes niveum","Ribes niveum","TRA Ganges 1959. Voucher at V labeled garden escape.","","","","Ribes niveum"
"381","ssi","Grossulariaceae","Ribes sanguineum","Ribes sanguineum","Open woodland; road verges.","","","","Ribes sanguineum"
"382","ssi","Haloragaceae","Myriophyllum verticillatum","Myriophyllum verticillatum","location?","","","","Myriophyllum verticillatum"
"383","ssi","Hydrangeaceae","Philadelphus lewisii","Philadelphus lewisii","Open, dry, wooded areas, talus slopes rock cliff bases.","","","","Philadelphus lewisii"
"384","ssi","Hydrocharitaceae","Elodea canadensis","Elodea canadensis","Occasional in ponds and sluggish waters. Farm ponds. St Mary Lake, Cusheon Lake.","","","","Elodea canadensis"
"385","ssi","Hydrocharitaceae","Najas flexilis","Najas flexilis","St Mary's Lake, Bullock Lake, Ford Lake, Stowell Lake,","","","","Najas flexilis"
"386","ssi","Hypericaceae","Hypericum anagalloides","Hypericum anagalloides","Wetlands, bogs, bluff seeps.","","","","Hypericum anagalloides"
"387","ssi","Hypericaceae","Hypericum perforatum","Hypericum perforatum","Roadsides, cultivated land, waste places.","","","","Hypericum perforatum"
"388","ssi","Iridaceae","Iris germanica","Iris × germanica","Persistant.","","","","Iris × germanica"
"389","ssi","Iridaceae","Iris pseudacorus","Iris pseudacorus","Ponds, fens and roadside ditches.","","","","Iris pseudacorus"
"390","ssi","Iridaceae","Sisyrinchium californicum","Sisyrinchium californicum","A&O Ceska location? Mt Tuam highland area?","","","","Sisyrinchium californicum"
"391","ssi","Iridaceae","Sisyrinchium idahoense","Sisyrinchium idahoense","Wet grassy meadows. Vars. ?","","","","Sisyrinchium idahoense"
"392","ssi","Isoetaceae","Isoetes nuttallii","Isoetes nuttallii","Abundant throughout Beaver Point camping area in wet seeps May 1996. McEwen SE of Musgrave Rock 2016.","","","","Isoetes nuttallii"
"393","ssi","Isoetaceae","Isoetes occidentalis","Isoetes occidentalis","Submerged in shallow water, St, Mary's Lake shore HJ August 1981. PDW St Mary's lake 1976.","","","","Isoetes occidentalis"
"394","ssi","Isoetaceae","Isoetes tenella","Isoetes tenella","Shallow water, shoreline St. Mary's Lake.","","","","Isoetes tenella"
"395","ssi","Juncaceae","Juncus acuminatus","Juncus acuminatus","Fens and wetlands throughout. Collections Bullocks and Cusheon Lakes.","","","","Juncus acuminatus"
"396","ssi","Juncaceae","Juncus alpinoarticulatus","Juncus alpinoarticulatus","St Mary Lake MCM and A&OC. V168274 Date: Sat, 14 Sep 1974 00:00:00 GMT Collector: Adolf Ceska; Oldriska Ceska","","","","Juncus alpinoarticulatus"
"397","ssi","Juncaceae","Juncus articulatus","Juncus articulatus","Fens and wet places throughout.","","","","Juncus articulatus"
"398","ssi","Juncaceae","Juncus balticus","Juncus balticus","Wet meadows, shoreline wetlands.","","","","Juncus balticus"
"399","ssi","Juncaceae","Juncus bolanderi","Juncus bolanderi","Roadside ditches and wetlands common throughout.","","","","Juncus bolanderi"
"400","ssi","Juncaceae","Juncus bufonius","Juncus bufonius","Common throughout on wet, disturbed ground.","","","","Juncus bufonius"
"401","ssi","Juncaceae","Juncus conglomeratus","Juncus conglomeratus","Zika roadside ditch Channel Ridge 2003.","","","","Juncus conglomeratus"
"402","ssi","Juncaceae","Juncus effusus ssp. effusus","Juncus effusus effusus","Common fens, wet meadows and fields throughout.","","""Maybe follow the FPNW and list it as ssp. effusus from Europe. Subspecies solutus from east N.A. may also be in the area"" FL —""I have definitely been observing multiple ssp of Juncus effusus around, inc. Je.solutus, J.e.pacificus, and J.e.effusus. The list should be updated to included record of all these infrataxa—how to update comments?""","","Juncus effusus effusus"
"403","ssi","Juncaceae","Juncus effusus ssp. pacificus","Juncus effusus pacificus","Common fens, wet meadows and fields throughout.","","""Maybe follow the FPNW and list it as ssp. effusus from Europe. Subspecies solutus from east N.A. may also be in the area"" FL —""I have definitely been observing multiple ssp of Juncus effusus around, inc. Je.solutus, J.e.pacificus, and J.e.effusus. The list should be updated to included record of all these infrataxa—how to update comments?""","","Juncus effusus pacificus"
"404","ssi","Juncaceae","Juncus ensifolius","Juncus ensifolius","Common fens, wet meadows and fields throughout.","","","","Juncus ensifolius"
"405","ssi","Juncaceae","Juncus gerardii","Juncus gerardi","Bedwell Harbour, Booth canal, ocean shore wetlands.","","","","Juncus gerardi"
"406","ssi","Juncaceae","Juncus supiniformis","Juncus supiniformis","A&OC Roberts Lake 1978.","","","","Juncus supiniformis"
"407","ssi","Juncaceae","Juncus tenuis","Juncus tenuis","Moist meadows, farm fields throughout.","","","","Juncus tenuis"
"408","ssi","Juncaceae","Luzula campestris","Luzula campestris","RDB Mt Belcher 1971. Zika Ruckle Park sunny roadside 2010.","","","","Luzula campestris"
"409","ssi","Juncaceae","Luzula comosa var. laxa","Luzula comosa laxa","Along Dubois Road near Musgrave Road and Beaver Point Zika 2010. Mt Belcher R. Bird 1971.","","","","Luzula comosa laxa"
"410","ssi","Juncaceae","Luzula macrantha","Luzula macrantha","Mt Maxwell and Mouat Park R. Bird 1971. Zika near Ruckle Park 2010.","","","","Luzula macrantha"
"411","ssi","Juncaceae","Luzula multiflora","Luzula multiflora","Open coniferous forests, lakeshore, bogs.","","","","Luzula multiflora"
"412","ssi","Juncaceae","Luzula parviflora","Luzula parviflora","TRA Beaver Point, HJ Maxwell Creek and Duck Creek","","","","Luzula parviflora"
"413","ssi","Juncaceae","Luzula subsessilis","Luzula subsessilis","RDB Mt Erskin 1971 and Ruckel Park 1971.","","","","Luzula subsessilis"
"414","ssi","Juncaginaceae","Triglochin maritima","Triglochin maritima","Salt marshes; common along rocky and muddy shores throughout.","","","","Triglochin maritima"
"415","ssi","Lamiaceae","Clinopodium douglasii","Clinopodium douglasii","Dry, open woods throughout the area.","","","","Clinopodium douglasii"
"416","ssi","Lamiaceae","Glechoma hederacea","Glechoma hederacea","Persisting and marginally escaping, old gardens.","","","","Glechoma hederacea"
"417","ssi","Lamiaceae","Lamiastrum galeobdolon","Lamium galeobdolon","No herbarium reccords but listed by the Invasive Species Council of BC for Vancouver Island and Gulf Islands. Persistant and marginally spreading.","","","","Lamium galeobdolon"
"418","ssi","Lamiaceae","Lamium purpureum","Lamium purpureum","Roadsides, waste ground.","","","","Lamium purpureum"
"419","ssi","Lamiaceae","Lycopus americanus","Lycopus americanus","TRA St Marys Lake date?","","","","Lycopus americanus"
"420","ssi","Lamiaceae","Lycopus asper","Lycopus asper","ICS location? date? No coast records found.","","","","Lycopus asper"
"421","ssi","Lamiaceae","Lycopus uniflorus","Lycopus uniflorus","Marshes and fens.","","","","Lycopus uniflorus"
"422","ssi","Lamiaceae","Marrubium vulgare","Marrubium vulgare","Waste ground, occasionaly open, grassy bluffs.","","","","Marrubium vulgare"
"423","ssi","Lamiaceae","Melissa officinalis","Melissa officinalis","Roadsides and waste places.","","","","Melissa officinalis"
"424","ssi","Lamiaceae","Mentha canadensis","Mentha canadensis","Wet ground, fens and lake edges.","","","","Mentha canadensis"
"425","ssi","Lamiaceae","Mentha spicata","Mentha spicata","Occasionaly naturalizing, low, wet places.","","","","Mentha spicata"
"426","ssi","Lamiaceae","Nepeta cataria","Nepeta cataria","HJ Burgoyne Valley, disturbed ground 1981.","","","","Nepeta cataria"
"427","ssi","Lamiaceae","Origanum vulgare","Origanum vulgare","TRA Fulford date? Luft iNaturalist report 2020, CricketFarm Blackburn Lake iNaturalist report 2020, Consumer Booth Canal iNaturalist report 2020.","","","","Origanum vulgare"
"428","ssi","Lamiaceae","Prunella vulgaris","Prunella vulgaris","Lawns, gardens, disturbed ground.","","","","Prunella vulgaris"
"429","ssi","Lamiaceae","Scutellaria galericulata","Scutellaria galericulata","HJ Roberts Lake 1981, TRA St Marys Lake date?","","","","Scutellaria galericulata"
"430","ssi","Lamiaceae","Scutellaria lateriflora","Scutellaria lateriflora","TRA report Stewart Lake - no voucher found.","","","","Scutellaria lateriflora"
"431","ssi","Lamiaceae","Stachys byzantina","Stachys byzantina","RDB Reginald Hill 1971, TRA Fulford date?","","","","Stachys byzantina"
"432","ssi","Lamiaceae","Stachys cooleyae","Stachys chamissonis cooleyae","Streambanks, fens, ditches.","","","","Stachys chamissonis cooleyae"
"433","ssi","Lentibulariaceae","Utricularia vulgaris ssp. macrorhiza","Utricularia macrorhiza","HJ Sphagnum Lake near Mt Bruce 1979, also many lowland lakes including Bullocks.","","","","Utricularia macrorhiza"
"434","ssi","Liliaceae","Erythronium oregonum ssp. oregonum","Erythronium oregonum","Grassy shorelines and points, rarely away from salt water.","","","","Erythronium oregonum"
"435","ssi","Liliaceae","Fritillaria affinis","Fritillaria affinis","Grassy ridges, points usually near salt water.","","","","Fritillaria affinis"
"436","ssi","Liliaceae","Fritillaria camschatcensis","Fritillaria camschatcensis","Goat Island, Ganges harbour TRA 1957.","","","","Fritillaria camschatcensis"
"437","ssi","Liliaceae","Lilium columbianum","Lilium columbianum","Damp, open woods and meadows, roadsides.","","","","Lilium columbianum"
"438","ssi","Liliaceae","Prosartes hookeri","Prosartes hookeri","Beaver Point TRA 1950. Fulford in creek drainage, south side of harbour. HJ April 1980.","","","","Prosartes hookeri"
"439","ssi","Liliaceae","Streptopus amplexifolius","Streptopus amplexifolius","TRA collections Mitchell Lake and Cranberry Bog 1957.","","","","Streptopus amplexifolius"
"440","ssi","Limnanthaceae","Limnanthes macounii","Limnanthes macounii","AC Beaver Point, Elanore Point 1978.","","","","Limnanthes macounii"
"441","ssi","Lythraceae","Lythrum salicaria","Lythrum salicaria","TRA Ganges 1957, HJ Ganges 1980.","","","","Lythrum salicaria"
"442","ssi","Malvaceae","Malva moschata","Malva moschata","Waste ground, roadsides.","","","","Malva moschata"
"443","ssi","Melanthiaceae","Toxicoscordion venenosum var. venenosum","Toxicoscordion venenosum venenosum","Grassy bluffs and ridges.","","","","Toxicoscordion venenosum venenosum"
"444","ssi","Melanthiaceae","Trillium ovatum","Trillium ovatum","Damp woods, on soil rich in humus.Cusheon Lake, Booth Bay, Ganges, St Marys Lake.","","","","Trillium ovatum"
"445","ssi","Melanthiaceae","Veratrum viride","Veratrum viride","Locaton? Mt Tuam-Mt Bruce plateau.","","","","Veratrum viride"
"446","ssi","Menyanthaceae","Menyanthes trifoliata","Menyanthes trifoliata","TRA St Marys Lake, HJ Weston Lake","","","","Menyanthes trifoliata"
"447","ssi","Montiaceae","Calandrinia ciliata","Calandrinia ciliata","Grassy, south facing bulffs, shorline ridges.","","","","Calandrinia ciliata"
"448","ssi","Montiaceae","Claytonia exigua ssp. exigua","Claytonia exigua exigua","Dry, shady sandy ground. RDB summit of Mt Belcher.","","","","Claytonia exigua exigua"
"449","ssi","Montiaceae","Claytonia parviflora","Claytonia parviflora","TRA Beaver Point 1957.","","","","Claytonia parviflora"
"450","ssi","Montiaceae","Claytonia perfoliata","Claytonia perfoliata","Open to shady, moist ground,; forming pure stands on slightly disturbed ground.","","","","Claytonia perfoliata"
"451","ssi","Montiaceae","Claytonia rubra","Claytonia rubra","TRA Ganges 1955. HLR Mt Maxwell 1985.","","","","Claytonia rubra"
"452","ssi","Montiaceae","Claytonia sibirica","Claytonia sibirica","Moist woods and thickets.","","","","Claytonia sibirica"
"453","ssi","Montiaceae","Montia dichotoma","Montia dichotoma","Open, grassy slopes, mossy rock seeps on shorelines.","","","","Montia dichotoma"
"454","ssi","Montiaceae","Montia fontana","Montia fontana","Moist meadows, seeps, vernal pools, margins of pond","","","","Montia fontana"
"455","ssi","Montiaceae","Montia howellii","Montia howellii","Trails, lake shorelines, mossy rock outcrops. Sandy beach on St Mary's Lake, mossy, seepy rock at Ruckle Point. Rut in parking area at Ford Lake.","","","","Montia howellii"
"456","ssi","Montiaceae","Montia linearis","Montia linearis","Grassy bluffs, mossy seeps.","","","","Montia linearis"
"457","ssi","Montiaceae","Montia parvifolia","Montia parvifolia","Stream banks and shady seeps on rocky outcrops, isolated mossy boulders.","recorded by HJ: Montia parvifolia var. flagellaris, syn. M.parvifolia in FPNW2","","","Montia parvifolia"
"458","ssi","Myricaceae","Myrica gale","Myrica gale","TRA Weston and Steward Lakes. HJ Bullocks Lake.","","","","Myrica gale"
"459","ssi","Nyctaginaceae","Abronia latifolia","Abronia latifolia","Gatten iNaturalist report east end of Ganges Harbour 2017.","","","","Abronia latifolia"
"460","ssi","Nymphaeaceae","Nuphar polysepala","Nuphar polysepala","Ponds and shallow lakes.","","","","Nuphar polysepala"
"461","ssi","Oleaceae","Fraxinus latifolia","Fraxinus latifolia","Chytyk Kingfisher Cove on shell miden 2012. Penn Fulford 1996,","","","","Fraxinus latifolia"
"462","ssi","Onagraceae","Chamaenerion angustifolium","Chamaenerion angustifolium","Disturbed ground, burns","","","","Chamaenerion angustifolium"
"463","ssi","Onagraceae","Circaea alpina ssp. pacifica","Circaea alpina pacifica","Cool, damp woods.","","","","Circaea alpina pacifica"
"464","ssi","Onagraceae","Clarkia amoena","Clarkia amoena","Grassy bluffs.","","","","Clarkia amoena"
"465","ssi","Onagraceae","Epilobium brachycarpum","Epilobium brachycarpum","Roadsides, grassy bluffs.","","","","Epilobium brachycarpum"
"466","ssi","Onagraceae","Epilobium ciliatum","Epilobium ciliatum","Wet meadows, fens, wet land edges.","","","","Epilobium ciliatum"
"467","ssi","Onagraceae","Epilobium minutum","Epilobium minutum","Grassy bluffs, ledges and banks. Straley Beddis Road 1991.","","","","Epilobium minutum"
"468","ssi","Onagraceae","Epilobium palustre","Epilobium palustre","collector? location?","","","","Epilobium palustre"
"469","ssi","Onagraceae","Ludwigia palustris","Ludwigia palustris","HJ Ford's Lake 1979 no collection.","","","","Ludwigia palustris"
"470","ssi","Onagraceae","Oenothera glazioviana","Oenothera glazioviana","RDB Fulford 1971.","","","","Oenothera glazioviana"
"471","ssi","Ophioglossaceae","Sceptridium multifidum","Sceptridium multifidum","Known from Maxwell Lake, St. Mary's Lake. ICS Cusheon Lake 1980.","","","","Sceptridium multifidum"
"472","ssi","Orchidaceae","Calypso bulbosa var. occidentalis","Calypso bulbosa occidentalis","Mossy spots, shaded mature forest.","","","","Calypso bulbosa occidentalis"
"473","ssi","Orchidaceae","Cephalanthera austiniae","Cephalanthera austiniae","Mt Tuam, Musgrave landing Donovan and Chytyk","","","","Cephalanthera austiniae"
"474","ssi","Orchidaceae","Corallorhiza maculata var. occidentalis","Corallorhiza maculata occidentalis","Moist or dry coniferous forest throughout. Several collections of var. ozettensis for island.","","","","Corallorhiza maculata occidentalis"
"475","ssi","Orchidaceae","Corallorhiza maculata var. ozettensis","Corallorhiza maculata ozettensis","St Marys Lake McEwen 2016, Blackburn Lake McEwen 2014. Mt Tuam ER McEwen 2016.","","","","Corallorhiza maculata ozettensis"
"476","ssi","Orchidaceae","Dactylorhiza viridis","Dactylorhiza viridis","TRA Russell Island, Fulford Harbour.","","","","Dactylorhiza viridis"
"477","ssi","Orchidaceae","Epipactis helleborine","Epipactis helleborine","D.L. Thompson Lepage Road 2020. Several locations iNaturalist.","","","","Epipactis helleborine"
"478","ssi","Orchidaceae","Goodyera oblongifolia","Goodyera oblongifolia","Moist or semidry moss floored coniferous forest; throughout.","","","","Goodyera oblongifolia"
"479","ssi","Orchidaceae","Neottia cordata","Neottia cordata","Common under dense Salal in second growth forests","","","","Neottia cordata"
"480","ssi","Orchidaceae","Platanthera dilatata","Platanthera dilatata","TRA Cranberry Bog.","","","","Platanthera dilatata"
"481","ssi","Orchidaceae","Platanthera elegans ssp. elegans","Platanthera elegans elegans","Dry, open coniferous forest, McCutcheon north of Vesuvius 1994.","","","","Platanthera elegans elegans"
"482","ssi","Orchidaceae","Platanthera huronensis","Platanthera huronensis","ICS personal collection, voucher not examined. Location?","","","","Platanthera huronensis"
"483","ssi","Orchidaceae","Platanthera stricta","Platanthera stricta","TRA Cranberry Bog.1957.","","","","Platanthera stricta"
"484","ssi","Orchidaceae","Platanthera transversa","Platanthera transversa","HJ Mt Tuam 1980.","","","","Platanthera transversa"
"485","ssi","Orchidaceae","Platanthera unalascensis","Platanthera unalascensis","Grassy, open places, dry coniferous forests.","","","","Platanthera unalascensis"
"486","ssi","Orchidaceae","Spiranthes romanzoffiana","Spiranthes romanzoffiana","Open, grassy places and parklands.","","","","Spiranthes romanzoffiana"
"487","ssi","Orobanchaceae","Aphyllon californicum ssp. californicum","Aphyllon californicum californicum","Parasitic on Grindelia, usually near shore line.","","","","Aphyllon californicum californicum"
"488","ssi","Orobanchaceae","Aphyllon purpureum","Aphyllon purpureum","Parasitic on Sedum and occasionally on Lithophragma.","","","","Aphyllon purpureum"
"489","ssi","Orobanchaceae","Bellardia viscosa","Bellardia viscosa","Roadsides, farm fields, pasture.","","","","Bellardia viscosa"
"490","ssi","Orobanchaceae","Castilleja attenuata","Castilleja attenuata","Open, grassy bluffs.","","","","Castilleja attenuata"
"491","ssi","Orobanchaceae","Castilleja hispida","Castilleja hispida","Grassy bluffs and ledges.","","","","Castilleja hispida"
"492","ssi","Orobanchaceae","Castilleja miniata var. dixonii","Castilleja miniata dixonii","TRA claim from Brackman Island, no voucher found.","","","","Castilleja miniata dixonii"
"493","ssi","Orobanchaceae","Castilleja victoriae","Castilleja victoriae","Newcombe Mt Tuam 1923.","","","","Castilleja victoriae"
"494","ssi","Orobanchaceae","Kopsiopsis hookeri","Kopsiopsis hookeri","ICS location? McDonald north slope Mt Erskin iNaturalist observation 2020. Kings Rd iNaturalist observation 2020.","","","","Kopsiopsis hookeri"
"495","ssi","Orobanchaceae","Rhinanthus minor ssp. groenlandicus","Rhinanthus groenlandicus","Meadows and grassy fields.","","","","Rhinanthus groenlandicus"
"496","ssi","Orobanchaceae","Triphysaria pusilla","Triphysaria pusilla","Meadows, weedy lawns.","","","","Triphysaria pusilla"
"497","ssi","Papaveraceae","Dicentra formosa","Dicentra formosa","Moist roadside, Blackburn Road. HJ,TRA,RDB.","","","","Dicentra formosa"
"498","ssi","Papaveraceae","Eschscholzia californica ssp. californica","Eschscholzia californica californica","Roadsides and waste ground.","","","","Eschscholzia californica californica"
"499","ssi","Papaveraceae","Meconella oregana","Meconella oregana","Maslovat Mt Tuam 2010, 2012.","","","","Meconella oregana"
"500","ssi","Papaveraceae","Papaver somniferum","Papaver somniferum","Occasional escapee from cultivation.","","","","Papaver somniferum"
"501","ssi","Phrymaceae","Erythranthe alsinoides","Erythranthe alsinoides","Grassy bluffs and ledges.","","","","Erythranthe alsinoides"
"502","ssi","Phrymaceae","Erythranthe guttata","Erythranthe guttata","Seepy spots on grassy bluffs, occasionally roadside ditches.","","","","Erythranthe guttata"
"503","ssi","Phrymaceae","Erythranthe moschata","Erythranthe moschata","Ponds, ditches with standing water.","","","","Erythranthe moschata"
"504","ssi","Phrymaceae","Erythranthe nasuta","Erythranthe nasuta","Benedict end of Isabella Road 1990.","","","","Erythranthe nasuta"
"505","ssi","Phrymaceae","Erythranthe ptilota","Erythranthe ptilota","TRA Booth Canal 1955.","","","","Erythranthe ptilota"
"506","ssi","Phrymaceae","Erythranthe sookensis","Erythranthe sookensis","GD 5.5 km SE of Ganges 1976.","not in FPNW2","","","Erythranthe sookensis"
"507","ssi","Pinaceae","Abies grandis","Abies grandis","Moist lowland forest; locally common.","","","","Abies grandis"
"508","ssi","Pinaceae","Picea sitchensis","Picea sitchensis","Very rare, south east shore line forest.","","","","Picea sitchensis"
"509","ssi","Pinaceae","Pinus contorta var. contorta","Pinus contorta contorta","Dry, south exposed woodlands, dry north slopes","","","","Pinus contorta contorta"
