"","area","Family","TaxonName","iNatTaxon","HJ_comment","FPNW_note","critical_comments","reviewed","iNat_taxon"
"510","ssi","Pinaceae","Pinus monticola","Pinus monticola","Absent from lowland forest. Occasional on high elevation plateau Mt Bruce to Mt Tuam.","","","","Pinus monticola"
"511","ssi","Pinaceae","Pseudotsuga menziesii","Pseudotsuga menziesii menziesii","Moist to dry areas; generally distributed throughout the forested areas.","","","","Pseudotsuga menziesii menziesii"
"512","ssi","Pinaceae","Tsuga heterophylla","Tsuga heterophylla","Upland, north facing slopes; common. Very rare on south slopes and mesic lowland forest.","","","","Tsuga heterophylla"
"513","ssi","Plantaginaceae","Callitriche heterophylla var. bolanderi","Callitriche heterophylla bolanderi","TRA Mitchel Lake, Cusheon Lake1957.","","","","Callitriche heterophylla bolanderi"
"514","ssi","Plantaginaceae","Callitriche palustris","Callitriche palustris","TRA Mitchell Lake date?- no voucher at Uvic","","","","Callitriche palustris"
"515","ssi","Plantaginaceae","Collinsia grandiflora","Collinsia grandiflora","Open, grassy bluffs.","","","","Collinsia grandiflora"
"516","ssi","Plantaginaceae","Collinsia parviflora","Collinsia parviflora","Open, grassy bluffs.","","","","Collinsia parviflora"
"517","ssi","Plantaginaceae","Cymbalaria muralis","Cymbalaria muralis","TRA Beaver Point date?","","","","Cymbalaria muralis"
"518","ssi","Plantaginaceae","Digitalis purpurea","Digitalis purpurea","Roadsides, waste places, logged ground.","","","","Digitalis purpurea"
"519","ssi","Plantaginaceae","Gratiola ebracteata","Gratiola ebracteata","ICS claim - no voucher found.","","","","Gratiola ebracteata"
"520","ssi","Plantaginaceae","Gratiola neglecta","Gratiola neglecta","ICS claim - no voucher found.","","","","Gratiola neglecta"
"521","ssi","Plantaginaceae","Limosella aquatica","Limosella aquatica","DPW St Marys Lake date? voucher location?","","","","Limosella aquatica"
"522","ssi","Plantaginaceae","Linaria dalmatica","Linaria dalmatica","lCS & RDB location? Dates? Canvasback Place iNaturalist report 2020.","","","","Linaria dalmatica"
"523","ssi","Plantaginaceae","Linaria purpurea","Linaria purpurea","Garden escapee.","","","","Linaria purpurea"
"524","ssi","Plantaginaceae","Linaria vulgaris","Linaria vulgaris","TRA Fulford","","","","Linaria vulgaris"
"525","ssi","Plantaginaceae","Plantago coronopus","Plantago coronopus","AC Ruckle Park 2010.","","","","Plantago coronopus"
"526","ssi","Plantaginaceae","Plantago elongata","Plantago elongata","Grassy bluffs, rocky shoreline ledges.","","","","Plantago elongata"
"527","ssi","Plantaginaceae","Plantago lanceolata","Plantago lanceolata","Lawns, waste ground, cultivated ground.","","","","Plantago lanceolata"
"528","ssi","Plantaginaceae","Plantago major","Plantago major","Lawns, roadsides and disturbed ground.","","","","Plantago major"
"529","ssi","Plantaginaceae","Plantago maritima","Plantago maritima","Rocky shoreline and salt marshes.","","","","Plantago maritima"
"530","ssi","Plantaginaceae","Tonella tenella","Tonella tenella","Open, rocky slopes above Sansum Narrows GD & FL. Also known from Maple Mountain, Mary Vine Creek, Sooke and talus and rocky bluffs above Elwah River, Olympic Peninsula.","","","","Tonella tenella"
"531","ssi","Plantaginaceae","Veronica americana","Veronica americana","Standing water in ditches, fens and ponds","","","","Veronica americana"
"532","ssi","Plantaginaceae","Veronica arvensis","Veronica arvensis","Waste ground, grassy bluffs, disturbed ground","","","","Veronica arvensis"
"533","ssi","Plantaginaceae","Veronica officinalis","Veronica officinalis","Roadsides and disturbed fields.","","","","Veronica officinalis"
"534","ssi","Plantaginaceae","Veronica peregrina var. xalapensis","Veronica peregrina xalapensis","Meadows, dirt roads, vernal wet spots.","","","","Veronica peregrina xalapensis"
"535","ssi","Plantaginaceae","Veronica persica","Veronica persica","TRA Ganges, date?","","","","Veronica persica"
"536","ssi","Plantaginaceae","Veronica scutellata","Veronica scutellata","Fens, pond edges.","","","","Veronica scutellata"
"537","ssi","Plantaginaceae","Veronica serpyllifolia","Veronica serpyllifolia","Moist meadows, wet ground and disturbed sites.","","","","Veronica serpyllifolia"
"538","ssi","Plumbaginaceae","Armeria maritima ssp. californica","Armeria maritima californica","Anderson 1896 Chain Islands.","","","","Armeria maritima californica"
"539","ssi","Poaceae","Achnatherum lemmonii ssp. lemmonii","Eriocoma lemmonii lemmonii","Open, grassy south facing bluffs","","","","Eriocoma lemmonii lemmonii"
"540","ssi","Poaceae","Agrostis capillaris","Agrostis capillaris","Meadow and pasture throughou.","","","","Agrostis capillaris"
"541","ssi","Poaceae","Agrostis exarata","Agrostis exarata","Roadsides and fields.","","","","Agrostis exarata"
"542","ssi","Poaceae","Agrostis gigantea","Agrostis gigantea","Lawns, fields and roadsides.","","","","Agrostis gigantea"
"543","ssi","Poaceae","Agrostis microphylla","Agrostis microphylla","Roadside and at salt springs. TRA Beaver Point.","","","","Agrostis microphylla"
"544","ssi","Poaceae","Agrostis pallens","Agrostis pallens","Dry upland pasture, roadsides.","","","","Agrostis pallens"
"545","ssi","Poaceae","Agrostis scabra","Agrostis scabra","Fens and bogs. HJ Mt Bruce, Mt Tuam, Lake Maxwell.","","","","Agrostis scabra"
"546","ssi","Poaceae","Aira caryophyllea","Aira caryophyllea","Open bluffs and grassy slopes, particularly where disturbed.","","","","Aira caryophyllea"
"547","ssi","Poaceae","Aira praecox","Aira praecox","Open bluffs and grassy slopes, particularly where disturbed.","","","","Aira praecox"
"548","ssi","Poaceae","Alopecurus aequalis","Alopecurus aequalis","Sphagnum lake shore east of Bruce Peak HJ 1979.","","","","Alopecurus aequalis"
"549","ssi","Poaceae","Alopecurus carolinianus","Alopecurus carolinianus","Mt Maxwell seepage area, McEwan.","","","","Alopecurus carolinianus"
"550","ssi","Poaceae","Alopecurus geniculatus","Alopecurus geniculatus","TRA Walker Hook, Ganges, Mt Tuam.","","","","Alopecurus geniculatus"
"551","ssi","Poaceae","Alopecurus pratensis","Alopecurus pratensis","Wet meadows and fields. ICS Booth Canal. TRA Mt Tuam.","","","","Alopecurus pratensis"
"552","ssi","Poaceae","Anthoxanthum odoratum","Anthoxanthum odoratum","Grassy bluffs, dry fields, roadsides throughout.","","","","Anthoxanthum odoratum"
"553","ssi","Poaceae","Apera interrupta","Apera interrupta","Darbyshire Mt Bruce 1983.","","","","Apera interrupta"
"554","ssi","Poaceae","Arrhenatherum elatius","Arrhenatherum elatius","Dry meadows, farm fields and roadside,","","","","Arrhenatherum elatius"
"555","ssi","Poaceae","Avena sativa","Avena sativa","Occasionally introduced by highways.","","","","Avena sativa"
"556","ssi","Poaceae","Bromus commutatus","Bromus commutatus","Lomer, Douglas, Penny Mt Erskine 2002.","","","","Bromus commutatus"
"557","ssi","Poaceae","Bromus diandrus","Bromus diandrus","Roadside, grassy bluffs, disturbed ground.","","","","Bromus diandrus"
"558","ssi","Poaceae","Bromus hordeaceus","Bromus hordeaceus","Bluffs, roadside and waste ground.","","","","Bromus hordeaceus"
"559","ssi","Poaceae","Bromus inermis","Bromus inermis","Roadside, disturbed ground.","","","","Bromus inermis"
"560","ssi","Poaceae","Bromus pacificus","Bromus pacificus","ICS collection Roberts lake. TRA Southey Point.","","","","Bromus pacificus"
"561","ssi","Poaceae","Bromus sitchensis","Bromus sitchensis","Var. aleutensis and marginatus","","","","Bromus sitchensis"
"562","ssi","Poaceae","Bromus sitchensis var. aleutensis","Bromus sitchensis aleutensis","Forest edges, bluffs, roadsides. Ganges RDB","","","","Bromus sitchensis aleutensis"
"563","ssi","Poaceae","Bromus sitchensis var. carinatus","Bromus carinatus","Shoreline bluffs, roadsides and waste places. LEP report var. marginatus (Neese ex Steud.) B. Boivin from Mt Tuam.","","","","Bromus carinatus"
"564","ssi","Poaceae","Bromus sterilis","Bromus sterilis","Fields, roadside and waste places throughout.","","","","Bromus sterilis"
"565","ssi","Poaceae","Bromus tectorum","Bromus tectorum","Roadsides, banks, and waste places.","","","","Bromus tectorum"
"566","ssi","Poaceae","Bromus vulgaris","Bromus vulgaris","Open woodland, trails.","","","","Bromus vulgaris"
"567","ssi","Poaceae","Calamagrostis canadensis","Calamagrostis canadensis","Var. langsdorfii HJ Bruce Peak","","","","Calamagrostis canadensis"
"568","ssi","Poaceae","Cinna latifolia","Cinna latifolia","Ruckle Park Ray July 1976","","","","Cinna latifolia"
"569","ssi","Poaceae","Cynosurus cristatus","Cynosurus cristatus","Fields, roadsides and waste places; common throughout.","","","","Cynosurus cristatus"
"570","ssi","Poaceae","Cynosurus echinatus","Cynosurus echinatus","Roadside and waste ground. Spreading into grassy bluffs.","","","","Cynosurus echinatus"
"571","ssi","Poaceae","Dactylis glomerata","Dactylis glomerata","Farm fields, roadsides and grassy bluffs.","","","","Dactylis glomerata"
"572","ssi","Poaceae","Danthonia californica","Danthonia californica","Grassy ridges and bluffs.","","","","Danthonia californica"
"573","ssi","Poaceae","Danthonia intermedia","Danthonia intermedia","Reginald Hill, Saltspring Island. Saltspring HRL location verified HJ","","","","Danthonia intermedia"
"574","ssi","Poaceae","Deschampsia danthonioides","Deschampsia danthonioides","Calder & MacKay Isabella Point 1961","","","","Deschampsia danthonioides"
"575","ssi","Poaceae","Deschampsia elongata","Deschampsia elongata","Roadside, disturbed and waste ground.","","","","Deschampsia elongata"
"576","ssi","Poaceae","Dichanthelium oligosanthes ssp. scribnerianum","Dichanthelium scribnerianum","HJ Reginald Hill 2003.","","","","Dichanthelium scribnerianum"
"577","ssi","Poaceae","Distichlis spicata","Distichlis spicata","Shoreline and strand.","","","","Distichlis spicata"
"578","ssi","Poaceae","Echinochloa crus-galli","Echinochloa crus-galli","Boat ramp Blackburn Lake HJ 2000.","","","","Echinochloa crus-galli"
"579","ssi","Poaceae","Elymus glaucus","Elymus glaucus","Open woods and dry hillside throughout.","","","","Elymus glaucus"
"580","ssi","Poaceae","Elymus repens","Elymus repens","Fields and waste places.","","","","Elymus repens"
"581","ssi","Poaceae","Festuca occidentalis","Festuca occidentalis","Shady, moss-floored forest, common.","","","","Festuca occidentalis"
"582","ssi","Poaceae","Festuca roemeri","Festuca roemeri","Grassy bluffs.","","","","Festuca roemeri"
"583","ssi","Poaceae","Festuca rubra","Festuca rubra","Grassy bluffs and hillsides throughout.","","","","Festuca rubra"
"584","ssi","Poaceae","Festuca subulata","Festuca subulata","Moist, shady forest throughout.","","","","Festuca subulata"
"585","ssi","Poaceae","Festuca subuliflora","Festuca subuliflora","Dry Douglas Fir forest throughout.","","","","Festuca subuliflora"
"586","ssi","Poaceae","Glyceria borealis","Glyceria borealis","Weston Lake HJ","","","","Glyceria borealis"
"587","ssi","Poaceae","Glyceria elata","Glyceria elata","RDB Mt Maxwell 1970, Darbyshire Musgrave Rd 1988, HJ Mt Tuam 1979, 2002","","","","Glyceria elata"
"588","ssi","Poaceae","Glyceria grandis","Glyceria grandis","ICS Duck Creek 1975","","","","Glyceria grandis"
"589","ssi","Poaceae","Glyceria leptostachya","Glyceria leptostachya","GD Duck Creek , F Lomer pond on Sunset Drive 2010.","","","","Glyceria leptostachya"
"590","ssi","Poaceae","Glyceria striata","Glyceria striata","RDB Mt Maxwell. Darbyshire 1988 Musgrave Rd. TRA 1957 Cranberry Bog and Beaver Pt Community Hall. HJ Roberts Lake 1981","","","","Glyceria striata"
"591","ssi","Poaceae","Holcus lanatus","Holcus lanatus","Meadows, Farm fields disturbed groun throughout","","","","Holcus lanatus"
"592","ssi","Poaceae","Hordeum brachyantherum","Hordeum brachyantherum","Wet meadows and salt marshes. TRA Burgoyne Bay, Southey Point, Brackman Island, Beaver Point.","","","","Hordeum brachyantherum"
"593","ssi","Poaceae","Hordeum jubatum ssp. jubatum","Hordeum jubatum jubatum","Booth Canal HJ, Fulford TRA.","","","","Hordeum jubatum jubatum"
"594","ssi","Poaceae","Hordeum murinum ssp. leporinum","Hordeum murinum leporinum","see H. m. ssp. Leporinum","","","","Hordeum murinum leporinum"
"595","ssi","Poaceae","Hordeum murinum ssp. murinum","Hordeum murinum murinum","Roadsides and waste ground throughout,","","","","Hordeum murinum murinum"
"596","ssi","Poaceae","Koeleria macrantha","Koeleria macrantha","Grassy bluffs and ledges.","","","","Koeleria macrantha"
"597","ssi","Poaceae","Leymus mollis ssp. mollis","Leymus mollis mollis","Rocky shorelines.","","","","Leymus mollis mollis"
"598","ssi","Poaceae","Lolium multiflorum","Lolium multiflorum","Roadside, farm fields, meadows and disturbed ground.","","","","Lolium multiflorum"
"599","ssi","Poaceae","Lolium perenne","Lolium perenne","Roadside, farm fields, meadows and disturbed ground.","","","","Lolium perenne"
"600","ssi","Poaceae","Melica harfordii","Melica harfordii","Dry Fir-Arbutus forest.","","","","Melica harfordii"
"601","ssi","Poaceae","Melica subulata","Melica subulata","Shady to open coniferous forest, trails;","","","","Melica subulata"
"602","ssi","Poaceae","Panicum miliaceum ssp. ruderale","Panicum miliaceum ruderale","HLR Channel Ridge 2004.","","","","Panicum miliaceum ruderale"
"603","ssi","Poaceae","Phalaris arundinacea","Phalaris arundinacea","Wet meadows, ponds and lake margins.","","","","Phalaris arundinacea"
"604","ssi","Poaceae","Phleum pratense","Phleum pratense","Meadows, roadsides and farm fields.","","","","Phleum pratense"
"605","ssi","Poaceae","Poa annua","Poa annua","Disturbed and waste ground throughout.","","","","Poa annua"
"606","ssi","Poaceae","Poa bulbosa","Poa bulbosa","Roaddsides, waste ground throughout.","","","","Poa bulbosa"
"607","ssi","Poaceae","Poa compressa","Poa compressa","Roadside and waste ground throughout.","","","","Poa compressa"
"608","ssi","Poaceae","Poa howellii","Poa howellii","Shady forest roadsides, logging roads.","","","","Poa howellii"
"609","ssi","Poaceae","Poa pratensis","Poa pratensis","Lawn, roadside, fields, grassy bluffs.","","","","Poa pratensis"
"610","ssi","Poaceae","Poa secunda ssp. secunda","Poa secunda secunda","Grassy bluffs, seaside cliffs; Recheck vouchers at V","","","","Poa secunda secunda"
"611","ssi","Poaceae","Poa trivialis","Poa trivialis","Alder bottoms and moist shady sites.","","","","Poa trivialis"
"612","ssi","Poaceae","Puccinellia distans","Puccinellia distans","TRA collection Booth Canal re-identified as P. nuttalliana","","","","Puccinellia distans"
"613","ssi","Poaceae","Puccinellia nutkaensis","Puccinellia nutkaensis","TRA Beaver Point. ICS Harkema Farm at salt springs 1977.","","","","Puccinellia nutkaensis"
"614","ssi","Poaceae","Puccinellia nuttalliana","Puccinellia nuttalliana","Salt marshes and mud flats.","","","","Puccinellia nuttalliana"
"615","ssi","Poaceae","Puccinellia pumila","Puccinellia pumila","HJ Booth Canal. HJ Fulford 1979. ICS Fulford 1977.","","","","Puccinellia pumila"
"616","ssi","Poaceae","Schedonorus arundinaceus","Lolium arundinaceum","Farm fields, meadows and roadsides.","","","","Lolium arundinaceum"
"617","ssi","Poaceae","Secale cereale","Secale cereale","Introduced by Highways for road cut stabilization.","","","","Secale cereale"
"618","ssi","Poaceae","Torreyochloa pallida var. pauciflora","Torreyochloa pallida pauciflora","Standing water, ponds, wetlands.","","","","Torreyochloa pallida pauciflora"
"619","ssi","Poaceae","Trisetum canescens","Trisetum canescens","Open Fir forest throughout.","","","","Trisetum canescens"
"620","ssi","Poaceae","Trisetum cernuum","Trisetum cernuum","Alder woodlands, Fir-sword fern forest.","","","","Trisetum cernuum"
"621","ssi","Poaceae","Vulpia bromoides","Festuca bromoides","Dry meadow, disturbed ground and roadsides","","","","Festuca bromoides"
"622","ssi","Poaceae","Vulpia microstachys","Festuca microstachys","Roadsides and disturbed areas.","","","","Festuca microstachys"
"623","ssi","Poaceae","Vulpia myuros","Festuca myuros","Dry, rocky bluffs, roadsides and disturbed area.","","","","Festuca myuros"
"624","ssi","Polemoniaceae","Collomia grandiflora","Collomia grandiflora","TRA Beaver Point 1957. ICS Blackburn Lake; Fulford: area of lake; Ganges Road 1979.","","","","Collomia grandiflora"
"625","ssi","Polemoniaceae","Collomia heterophylla","Collomia heterophylla","Open ground, dirt roads.","","","","Collomia heterophylla"
"626","ssi","Polemoniaceae","Leptosiphon bicolor","Leptosiphon bicolor","Open grassy bluffs and ridges.","","","","Leptosiphon bicolor"
"627","ssi","Polemoniaceae","Leptosiphon minimus","Leptosiphon minimus","FL,GD,JP Mt Maxwell 2002.","","","","Leptosiphon minimus"
"628","ssi","Polemoniaceae","Microsteris gracilis","Microsteris gracilis","Open bluffs, grassy roadsides, dirt roads.","","","","Microsteris gracilis"
"629","ssi","Polemoniaceae","Navarretia squarrosa","Navarretia squarrosa","Open ground, fields, and roadsides.","","","","Navarretia squarrosa"
"630","ssi","Polygonaceae","Fallopia convolvulus","Fallopia convolvulus","Gardens, waste ground, disturbed ground.","","","","Fallopia convolvulus"
"631","ssi","Polygonaceae","Fallopia japonica","Reynoutria japonica","Thompson downtown Fulford 2020. iNaturalist report.","","","","Reynoutria japonica"
"632","ssi","Polygonaceae","Persicaria amphibia","Persicaria amphibia","Ponds, wetlands, lake edges.","","","","Persicaria amphibia"
"633","ssi","Polygonaceae","Persicaria lapathifolia","Persicaria lapathifolia","Disturbed ground, gardens.","","","","Persicaria lapathifolia"
"634","ssi","Polygonaceae","Persicaria maculosa","Persicaria maculosa","Disturbed ground, gardens, wet meadows.","","","","Persicaria maculosa"
"635","ssi","Polygonaceae","Polygonum aviculare","Polygonum aviculare","Open, waste places, hard-packed soil and disturbed cultivated land; a common and aggressive weed throughout;","","","","Polygonum aviculare"
"636","ssi","Polygonaceae","Polygonum douglasii","Polygonum douglasii","ICS report from Isabella Point. Check.","","","","Polygonum douglasii"
"637","ssi","Polygonaceae","Polygonum fowleri","Polygonum fowleri","Beaches, salt marsh edges.","","","","Polygonum fowleri"
"638","ssi","Polygonaceae","Polygonum spergulariiforme","Polygonum spergulariiforme","Bluffs, grassy rocky south facing slopes.","","","","Polygonum spergulariiforme"
"639","ssi","Polygonaceae","Rumex acetosella","Rumex acetosella","Grassy bluffs, roadside, cultivated and disturbed ground.","","","","Rumex acetosella"
"640","ssi","Polygonaceae","Rumex conglomeratus","Rumex conglomeratus","Disturbed ground, wetlands.","","","","Rumex conglomeratus"
"641","ssi","Polygonaceae","Rumex crispus","Rumex crispus","Gardens, cultivated ground.","","","","Rumex crispus"
"642","ssi","Polygonaceae","Rumex obtusifolius","Rumex obtusifolius","Roadside, wet wasteland, gardens.","","","","Rumex obtusifolius"
"643","ssi","Polygonaceae","Rumex occidentalis","Rumex occidentalis","Southy Point HJ. TRA Ganges 1956.","","","","Rumex occidentalis"
"644","ssi","Polygonaceae","Rumex salicifolius","Rumex salicifolius","Beaches, driftwood.","","","","Rumex salicifolius"
"645","ssi","Polypodiaceae","Polypodium glycyrrhiza","Polypodium glycyrrhiza","Shaded north slopes, mossy rocks, tree trunks; common throughout.","","","","Polypodium glycyrrhiza"
"646","ssi","Potamogetonaceae","Potamogeton amplifolius","Potamogeton amplifolius","Cushon Lake.","","","","Potamogeton amplifolius"
"647","ssi","Potamogetonaceae","Potamogeton berchtoldii","Potamogeton berchtoldii","Bullock L., Weston L.","","","","Potamogeton berchtoldii"
"648","ssi","Potamogetonaceae","Potamogeton crispus","Potamogeton crispus","Shallow shore line, St. Mary's Lake.","","","","Potamogeton crispus"
"649","ssi","Potamogetonaceae","Potamogeton epihydrus","Potamogeton epihydrus","Shallow shoreline, Maxwell Lake.","","","","Potamogeton epihydrus"
"650","ssi","Potamogetonaceae","Potamogeton foliosus","Potamogeton foliosus","50 cm deep standing water Bullocks Lake","","","","Potamogeton foliosus"
"651","ssi","Potamogetonaceae","Potamogeton gramineus","Potamogeton gramineus","St. Mary's Lake.","","""Potamogeton gramineus - Note says native to Europe, which is true, but it is also a native to N.A. including BC"" FL","","Potamogeton gramineus"
"652","ssi","Potamogetonaceae","Potamogeton natans","Potamogeton natans","Shallow standing waters and lakes throughout.","","","","Potamogeton natans"
"653","ssi","Potamogetonaceae","Potamogeton obtusifolius","Potamogeton obtusifolius","Shoreline Maxwell Lake, St. Mary's Lake, Cusheon Lake.","","","","Potamogeton obtusifolius"
"654","ssi","Potamogetonaceae","Potamogeton pusillus","Potamogeton pusillus","PDW Weston Lake, St Mary Lake 1976.","","","","Potamogeton pusillus"
"655","ssi","Potamogetonaceae","Potamogeton robbinsii","Potamogeton robbinsii","Lakes including Weston, Ford, Cusheon and Roberts Lakes. Zika 2016 Blackburn Lake.","","","","Potamogeton robbinsii"
"656","ssi","Primulaceae","Dodecatheon hendersonii","Primula hendersonii","TRA Fulford, HJ Mt Tuam, Mt Maxwell.","","","","Primula hendersonii"
"657","ssi","Primulaceae","Dodecatheon pulchellum var. macrocarpum","Primula pauciflora macrocarpa","TRA Fernwood 1958, RDB Mt Belcher 1971, Hardy Chain Islands 1949,","","","","Primula pauciflora macrocarpa"
"658","ssi","Primulaceae","Hottonia palustris","Hottonia palustris","Yearsley pond near Cusheon Lake 2005. Thompson iNaturalist observation 2018 suggests that it is naturalizing. On Lomer & Penny's BC excluded list.","","","","Hottonia palustris"
"659","ssi","Primulaceae","Lysimachia arvensis","Lysimachia arvensis","Disturbed ground, often where water pools.","","","","Lysimachia arvensis"
"660","ssi","Primulaceae","Lysimachia europaea","Lysimachia europaea","HJ Mt Bruce bogs","","","","Lysimachia europaea"
"661","ssi","Primulaceae","Lysimachia latifolia","Lysimachia latifolia","Shady, open upland forest.","","","","Lysimachia latifolia"
"662","ssi","Primulaceae","Lysimachia maritima","Lysimachia maritima","Booth Canal HJ 1979, TRA date?","","","","Lysimachia maritima"
"663","ssi","Primulaceae","Lysimachia minima","Lysimachia minima","FL Ruckle Park Light path, rocky headland through Douglas-fir and Garry oak with Montia fontana, Veronica peregrina, Plagiobothrys scouleri ; in bare dark muck where water collects 2002","","","","Lysimachia minima"
"664","ssi","Primulaceae","Lysimachia thyrsiflora","Lysimachia thyrsiflora","St Mary's Lake TRA","","","","Lysimachia thyrsiflora"
"665","ssi","Pteridaceae","Adiantum aleuticum","Adiantum aleuticum","Shady stream valleys and waterfalls.","","","","Adiantum aleuticum"
"666","ssi","Pteridaceae","Aspidotis densa","Aspidotis densa","HJ Mt Maxwell 1985.Maxwell Point, section L330. Known nearby from Maple Bay. Thompson Channel Ridge iNaturalist report 2021.","","","","Aspidotis densa"
"667","ssi","Pteridaceae","Cryptogramma acrostichoides","Cryptogramma acrostichoides","Arnell Park. details? Thompson Sir Echos Way iNaturalist report 2018.","","","","Cryptogramma acrostichoides"
"668","ssi","Pteridaceae","Pentagramma triangularis","Pentagramma triangularis","South facing rocky ledges.","","","","Pentagramma triangularis"
"669","ssi","Ranunculaceae","Anemone lyallii","Anemonoides grayi","ICS Mt Maxwell, HJ Mt Maxwell high north slope 1996.","","","","Anemonoides grayi"
"670","ssi","Ranunculaceae","Aquilegia formosa","Aquilegia formosa","Shady disturbed forest, roadsides.","","","","Aquilegia formosa"
"671","ssi","Ranunculaceae","Aquilegia vulgaris","Aquilegia vulgaris","Persisting in old and abandoned gardens.","","","","Aquilegia vulgaris"
"672","ssi","Ranunculaceae","Clematis vitalba","Clematis vitalba","RDB Beaver Point 1971, King Isabella Point 1958. TRA Fulford, Ganges.","","","","Clematis vitalba"
"673","ssi","Ranunculaceae","Delphinium ajacis","Consolida ajacis","Escaping into waste areas. No collections.","","","","Consolida ajacis"
"674","ssi","Ranunculaceae","Delphinium menziesii","Delphinium menziesii","Coastal bluffs, grassy meadows, and wooded dry places. TRA Mouat Point, Ganges","","","","Delphinium menziesii"
"675","ssi","Ranunculaceae","Myosurus minimus","Myosurus minimus","TRA Beaver Point date?","","","","Myosurus minimus"
"676","ssi",NA,"Ranunculus × heimburgerae","Ranunculus × heimburgerae","Hardy Deadman Islands 1949.","not in FPNW2","","",NA
"677","ssi","Ranunculaceae","Ranunculus acris","Ranunculus acris","Roadsides and meadows.","","","","Ranunculus acris"
"678","ssi","Ranunculaceae","Ranunculus aquatilis","Ranunculus aquatilis","Lakes and Ponds. TRA Beaver Point, Booth Canal.","","","","Ranunculus aquatilis"
"679","ssi","Ranunculaceae","Ranunculus bulbosus","Ranunculus bulbosus","Luft Fraser Rd 2020 iNaturalist report, Cricket Farm iNaturalist report 2019.","","","","Ranunculus bulbosus"
"680","ssi","Ranunculaceae","Ranunculus flammula","Ranunculus flammula","Lake shores and standing water at fen edges. TRA St Marys Lake 1958","","","","Ranunculus flammula"
"681","ssi","Ranunculaceae","Ranunculus occidentalis var. occidentalis","Ranunculus occidentalis occidentalis","Ridges, forest edges, dry meadows.","","","","Ranunculus occidentalis occidentalis"
"682","ssi","Ranunculaceae","Ranunculus orthorhynchus","Ranunculus orthorhynchus","TRA Fernwood","","","","Ranunculus orthorhynchus"
"683","ssi","Ranunculaceae","Ranunculus repens","Ranunculus repens","Moist areas, meadows, lawns.","","","","Ranunculus repens"
"684","ssi","Ranunculaceae","Ranunculus sardous","Ranunculus sardous","RDB collections various locations.","","","","Ranunculus sardous"
"685","ssi","Ranunculaceae","Ranunculus uncinatus","Ranunculus uncinatus","Wet meadow, logging roads, wetland edges.","","","","Ranunculus uncinatus"
"686","ssi","Ranunculaceae","Thalictrum occidentale","Thalictrum occidentale","MCM Beaver Point 1961.","","","","Thalictrum occidentale"
