108,V241907,,,Poaceae,Poa infirma,Poa,,infirma,Kunth,,,,,NA,NA,NA,Canada,British Columbia,"Galiano Island, Sturdies Bay, BC Ferries dock, by crosswalk at ramp",48,52,40.7,-123,18,59.3,48.877972,-123.316472,Unknown,NA,Verbatim from Collector/Sheet,David Rowswell,2018,,,,"Crumbling blacktop margin with Poa annua, Polygonum aviculare subsp. depressum, Matricaria discoidea, Rosa nutkana shoots",3 m,2014 May 13,Frank Lomer,,8696,Frank Lomer,2014,"yellowish tinged plants, largest anthers ca. 0.3 mm; 30 x 30 cm patch",Poa infirma by Frank Lomer 2014,,,,NA,,NA,,,,NA,,,,,,,,Yes,bnbgrass,,,,V241907
110,V241909,,,Poaceae,Poa infirma,Poa,,infirma,Kunth,,,,,NA,NA,NA,Canada,British Columbia,"Galiano Island, Montague Harbour Provincial Park, lagoon north of Gray Peninsula, northeast shore",48,53,50.5,-123,24,21.3,48.897361,-123.405917,Unknown,NA,Verbatim from Collector/Sheet,David Rowswell,2018,,,,"Solid, but long dead fallen Douglas-fir lying in tidal mud; growing in bark furrows with Cerastium glomeratum, Plantago maritima, Veronica arvensis, Bromus carinatus",1 m,2014 May 13,Frank Lomer,,8698,Frank Lomer,2014,"dense patches for 20 m along log, mostly senescent plants, dead and straw-coloured",Poa infirma by Frank Lomer 2014,,,,NA,,NA,,,,NA,,,,,,,,Yes,bnbgrass,,,,V241909
223,V252619,6/23/2022,,Poaceae,Poa pratensis,Poa,,pratensis,L.,,,,,NA,NA,NA,Canada,British Columbia,"Galiano Island, Mount Sutil",48.869073,NA,NA,-123.378621,NA,NA,48.869073,-123.378621,Unknown,NA,Verbatim from Collector/Sheet,Erika Brauner,2022,,,,Open woodland / herbaceous community,250 m,2017 May 29,Andrew Simon,Alexander J. Wright,V-114,Andrew Simon,2017,,Poa pratensis by Andrew Simon  2017,,,,NA,,NA,,,,NA,,,,,,,,Yes,ASimon2017,,,,V252619
88,V231290,,,Poaceae,Poa secunda ssp. secunda,Poa,,secunda,J. Presl,secunda,,,,NA,NA,NA,Canada,British Columbia,"Galiano Island, Matthews Point, southwest side",48,51,48,-123,19,45,48.863333,-123.329167,Unknown,NA,Verbatim from Collector/Sheet,David Rowswell,2018,,,,southwest-facing exposed mossy seaside slope,120 m,2003 Apr 30,Frank Lomer,,4714,Frank Lomer,2003,Infrequent.,Poa secunda subsp. secunda by Frank Lomer 2003,,,,NA,,NA,,,,NA,,,,,,,,,bnbgrass,,,,V231290
2,V103250,,,Polypodiaceae,Polypodium glycyrrhiza,Polypodium,,glycyrrhiza,D.C. Eaton,,,,,NA,NA,NA,Canada,British Columbia,"Capital Regional District, Gulf Islands, Galiano Island, Bodega Hill, southeast of north Galiano",48,58,NA,-123,32,NA,48.966667,-123.533333,Unknown,NA,Verbatim from Collector/Sheet,David Rowswell,2018,,,,common in crevices below boulder in coniferous forest,,1961 May 08,James A. Calder,K.T. MacKay,28859,Sherry A. Whitmore 1983,,,,,,,NA,,NA,,,,NA,,,,,,,,,,,,,V103250
130,V245147,11/2/2018,,Polypodiaceae,Polypodium glycyrrhiza,Polypodium,,glycyrrhiza,D.C. Eaton,,,,,NA,NA,NA,Canada,British Columbia,"Galiano Island, Montague",48.897712,NA,NA,-123.409038,NA,NA,48.897712,-123.409038,Unknown,NA,Verbatim from Collector/Sheet,David Rowswell,2018,,,,Littoral; on Douglas-fir (Pseudotsuga menziesii) branch extending out over shoreline,,2016 Mar 03,Andrew Simon,,V-06,Andrew Simon,2016,,Polypodium glycyrrhiza by Andrew Simon 2016,,,,NA,,NA,,,,NA,,"On loan to LAF, 2018 Nov (UBC_2018_V6)",,,,,Yes,Yes,"AndrewSimon2016, LAF2018",,,,V245147
126,V242504,,Yes,Salicaceae,Populus tremuloides var. vancouveriana,Populus,,tremuloides,,,,vancouveriana,,NA,NA,NA,Canada,British Columbia,"Galiano Island, DL-57, near western shore, Trincomali Channel",NA,NA,NA,NA,NA,NA,NA,NA,,NA,,,NA,,10 464987 5419842,,"CDF/14, 6/Mm; rocky bluffs, sylvan pool (a small depression along a ridge), dominated by Populus and Thuja plicata; understory characterized by a mosaic of salal (Gaultheria shallon), slough sedge (Carex obnupta) and barren areas of browsed cedar and aspen regeneration; abundant epiphyte community, including Dichelyma uncinata, Evernia prunastri, Isothecium, sp., Lobaria pulmonaria, Neckera douglasii, Orthotrichum lyellii, Platismatia glauca, Porella navicularis, Porella spp.; also noted, minor presence: Alnus rubra, Amelanchier florida, Galium sp., Kindbergia oregana, K. praelonga, Polystichum muticum, Rhytidiadelphus loreus, R. triquetris , Spiraea douglasii",,2015 Sep 27,Andrew D. Simon,,s.n.,Quentin Cronk,2015,plot 05,Populus tremula subsp. tremuloides var. vancouveriana by Quentin Cronk 2015,,,,NA,,NA,,,,NA,,,Deaccessioned duplicate with same number sent on exchange to the University of Washington (WTU) 2018,"Original Accession # V242504a, not a multisheet, New Accession # V242504",,,,,,,,,V242504
202,V252598,6/23/2022,,Salicaceae,Populus tremuloides var. vancouveriana,Populus,,tremuloides,Michx.,,,vancouveriana,(Trel.) Sarg.,NA,NA,NA,Canada,British Columbia,"Galiano Island, District Lot 57",48.930527,NA,NA,-123.477536,NA,NA,48.930527,-123.477536,Unknown,NA,Verbatim from Collector/Sheet,Erika Brauner,2022,,,,Sylvan pool / depression inland of coastal bluff,40 m,2017 May 27,Andrew Simon,"Quentin Cronk, Diana Percy",V-85,Quentin Cronk,2017,putative variety of Populus tremuloides,Populus tremuloides by Quentin Cronk  2017,,,,NA,,NA,,,,NA,,,,,,,,Yes,ASimon2017,,,,V252598
74,V197833,,,Rosaceae,Prunus laurocerasus,Prunus,,laurocerasus,L.,,,,,NA,NA,NA,Canada,British Columbia,"Gulf Islands, southern Galiano Island, along Burrell Road, near Sturdies Bay road",NA,NA,NA,NA,NA,NA,NA,NA,,NA,,,NA,,,,near large cultivated tree along road,,1989 Apr 06,Gerald B. Straley,K. Wilf Nicholls,5283,"Gerald B. Straley, K. Wilf Nicholls",1989,Commonly naturalized,"Prunus laurocerasus by Gerald B. Straley, K. Wilf Nicholls 1989","Prunus laurocerasus Det. P.F. Zika 2004, WTU",,,NA,,NA,,,,NA,,,,,,,Yes,,,2008 - Dr. Gerald Straley's historical collection of the flora of B.C. digitization project (Irving K. Barber Learning Centre),,,V197833
109,V241908,,,Rosaceae,Prunus x pugetensis,Prunus,,x pugetensis,Jacobson & Zika,,,,,NA,NA,NA,Canada,British Columbia,"Galiano Island, Sturdies Bay, backyard of house at corner of Gulf Road and Sturdies Bay Road",48,52,42.5,-123,18,59.5,48.878472,-123.316528,Unknown,NA,Verbatim from Collector/Sheet,David Rowswell,2018,,,,"Rough backyard lot full of Bromus sterilis with Arbutus menziesii, Pseudotsuga menziesii",10 m,2014 May 13,Frank Lomer,,8697,Frank Lomer,2014,"single tree 9-10 m tall, bark with horizontal lenticels, having a stretched fat appearance, petals hairy, ca. 9 mm, leaves hairy; flowers in large clusters, petals starting to fall and mostly fallen off pressed sample",Prunus x pugetensis by Frank Lomer 2014,,,,NA,,NA,,,,NA,,,,,,,,Yes,flomer1,,,,V241908
13,V139278,,,Fagaceae,Quercus garryana,Quercus,,garryana,Douglas ex Hook.,,,,,NA,NA,NA,Canada,British Columbia,"Capital Regional District, Gulf of Georgia, Galiano Island",48,56,NA,-123,27,NA,48.933333,-123.45,Unknown,NA,Verbatim from Collector/Sheet,David Rowswell,2018,,,,on bluff overlooking valley,,1972 May 02,B. Schwartz,"M. Nemeth, B. Stephens, R. Biggs, John Pinder Moss",38,John Pinder-Moss 1972,,,,,,,NA,,NA,,,,NA,,,,,,,,,,,,,V139278
123,V241922,,,Orobanchaceae,Rhinanthus minor ssp. minor,Rhinanthus,,minor,L.,minor,,,,NA,NA,NA,Canada,British Columbia,"Galiano Island, 1 km due south of Sturdies Bay ferry dock, Burrill Road, ca. 75 m south of Arbutus Point Road",48,52,6,-123,18,56,48.868333,-123.315556,Unknown,NA,Verbatim from Collector/Sheet,David Rowswell,2018,,,,Grassy roadside,8 m,2014 May 14,Frank Lomer,,8711,Frank Lomer,2014,adaxial lip of corolla purple; small patch,Rhinanthus minor subsp. minor by Frank Lomer 2014,,,,NA,,NA,,,,NA,,,,,,,,Yes,flomer1,,,,V241922
139,V245156,,,Ericaceae,Rhododendron groenlandicum,Rhododendron,,groenlandicum,(Oeder) Kron & Judd,,,,,NA,NA,NA,Canada,British Columbia,"Galiano Island, Galiano Island Ecological Reserve",48.983659,NA,NA,-123.556323,NA,NA,48.983659,-123.556323,Unknown,NA,Verbatim from Collector/Sheet,David Rowswell,2018,,,,Bog,,2016 May 24,Andrew Simon,,V-15,Andrew Simon,2016,,Rhododendron groenlandicum by Andrew Simon 2016,,,,NA,,NA,,,,NA,,,,,,,,Yes,AndrewSimon2016,,,,V245156
19,V156689,,,Grossulariaceae,Ribes lobbii,Ribes,,lobbii,A. Gray,,,,,NA,NA,NA,Canada,British Columbia,"Capital Regional District, Gulf of Georgia, Galiano Island",48,56,NA,-123,27,NA,48.933333,-123.45,Unknown,NA,Verbatim from Collector/Sheet,David Rowswell,2018,,,,Cut-over area near bluff drive,,1974 Apr 21,Wilfred B. Schofield,,s.n.,Wilfred B. Schofield,1974,,Ribes lobbii by Wilfred B. Schofield 1974,,,,NA,,NA,,Leaf material sampled in 2013 by Leo K. Leung for herbarium DNA barcoding by Erin R. Manton (University of British Columbia),,NA,,,,,,,Yes,Yes,,,,,V156689
77,V197836,,,Rosaceae,Rubus bifrons,Rubus,,bifrons,Vest,,,,,NA,NA,NA,Canada,British Columbia,"southern Galiano Island, Bellhouse Park Road",NA,NA,NA,NA,NA,NA,NA,NA,,NA,,,NA,,,,in waste areas along roadside,,1989 Apr 06,Gerald B. Straley,K. Wilf Nicholls,5286,Doug Goldman,2009,common,"Rubus discolor by Gerald B. Straley, K. Wilf Nicholls 1989","Rubus bifrons Det. Doug Goldman 2009, Gray Herbarium of Harvard University (GH)",,,NA,,NA,,"Destructively sampled for genotyping by Jeff Groh, 2018 May, University of British Columbia",,NA,,"Returned
on loan to GH, 2009 Aug (UBC-2009-V5) - Returned 2009 Dec",,,,,Yes,,,2008 - Dr. Gerald Straley's historical collection of the flora of B.C. digitization project (Irving K. Barber Learning Centre),,,V197836
76,V197835,,,Rosaceae,Rubus laciniatus,Rubus,,laciniatus,Willd.,,,,,NA,NA,NA,Canada,British Columbia,"Gulf Islands, Galiano Island, Bellhouse Park road, southern Galiano Island",NA,NA,NA,NA,NA,NA,NA,NA,,NA,,,NA,,,,in waste areas along roadside,,1989 Apr 06,Gerald B. Straley,K. Wilf Nicholls,5285,"Gerald B. Straley, K. Wilf Nicholls",1989,Common,"Rubus laciniatus by Gerald B. Straley, K. Wilf Nicholls 1989",,,,NA,,NA,,,,NA,,,,,,,Yes,,,2008 - Dr. Gerald Straley's historical collection of the flora of B.C. digitization project (Irving K. Barber Learning Centre),,,V197835
68,V196653,,,Rosaceae,Rubus spectabilis,Rubus,,spectabilis,Pursh,,,,,NA,NA,NA,Canada,British Columbia,"southern Galiano Island, roadside near entrance to Bluff Park",48,55,NA,-123,20,NA,48.916667,-123.333333,Unknown,NA,Verbatim from Collector/Sheet,David Rowswell,2018,,,,edge of woods,,1988 Apr 23,Gerald B. Straley,,4612,Gerald B. Straley,1988,unusual form with mostly simple leaves,Rubus spectabilis by Gerald B. Straley 1988,,,,NA,,NA,,"Stomatal density analysis of Rubus spectabilis for Rising carbon dioxide, leaf morphology and vegetation dynamics in coastal B.C. by Ben Leyland, Simon Fraser University 2012, University of British Columbia",,NA,,,,,,,Yes,,,2008 - Dr. Gerald Straley's historical collection of the flora of B.C. digitization project (Irving K. Barber Learning Centre),,,V196653
93,V231295,,,Caryophyllaceae,Sagina apetala,Sagina,,apetala,Ard.,,,,,NA,NA,NA,Canada,British Columbia,"Galiano Island, Bluffs Park, summit viewpoint overlooking Active Pass, 30 m west of shelter",48,52,3.5,-123,20,23.8,48.867639,-123.339944,Unknown,NA,Verbatim from Collector/Sheet,David Rowswell,2018,,,,"Damp trampled path with Poa annua, Aphanes microcarpa",35 m,2003 May 01,Frank Lomer,,4719,Frank Lomer,2003,100+ plants.,Sagina apetala by Frank Lomer 2003,STET Jamie D. Fenneman 2014,,,NA,,NA,,,,NA,,,,,,,,Yes,apetala,,,,V231295
66,V194353,4/12/2022,,Caryophyllaceae,Sagina decumbens ssp. occidentalis,Sagina,,decumbens,(Elliott) Torr. & A. Gray,occidentalis,(S. Watson) G.E. Crow,,,NA,NA,NA,Canada,British Columbia,"Gulf Islands, Galiano Island, southern Galiano Island, Bellhouse Park road",48,55,NA,-123,20,NA,48.916667,-123.333333,Unknown,NA,Verbatim from Collector/Sheet,David Rowswell,2018,,,,"Vernally wet, grassy area in shallow soil above rocks",,1988 Apr 23,Gerald B. Straley,,4617,Frank Lomer,2022,,Spergularia canadensis by Gerald B. Straley 1988,a = Spergula arvensis Det. Frank Lomer 1994; b = Sagina occidentalis Det. Frank Lomer 1994 Nov 12,STET Jamie D. Fenneman 2014,"b = Sagina decumbens subsp. occidentalis Con. Frank Lomer 2022 Mar 11, University of British Columbia Herbarium",NA,,NA,,,,NA,,,,,,,Yes,,,2008 - Dr. Gerald Straley's historical collection of the flora of B.C. digitization project (Irving K. Barber Learning Centre),,,V194353
198,V252594,6/23/2022,,Caryophyllaceae,Sagina decumbens ssp. occidentalis,Sagina,,decumbens,(Elliott) Torr. & A. Gray,occidentalis,(S. Watson) G.E. Crow,,,NA,NA,NA,Canada,British Columbia,"Galiano Island, Lion Islet",48.90069685,NA,NA,-123.3361244,NA,NA,48.90069685,-123.3361244,Unknown,NA,Verbatim from Collector/Sheet,Erika Brauner,2022,,,,Coastal bluff herbaceous community,5 m,2017 May 19,Andrew Simon,,V-81,Andrew Simon,2017,,Sagina decumbens by Andrew Simon  2017,,,,NA,,NA,,,,NA,,,,,,,,Yes,ASimon2017,,,,V252594
112,V241911,,,Caryophyllaceae,Sagina maxima ssp. maxima,Sagina,,maxima,A. Gray,maxima,,,,NA,NA,NA,Canada,British Columbia,"Galiano Island, Montague Harbour Provincial Park, near amphitheatre and picnic tables",48,53,53.2,-123,24,6.5,48.898111,-123.401806,Unknown,NA,Verbatim from Collector/Sheet,David Rowswell,2018,,,,"Wet grassy area, too wet yet to cut; growing with Plantago elongata, Myosurus minimus, Poa annua",3 m,2014 May 13,Frank Lomer,,8700,Frank Lomer,2014,"erect annual, sepals 5, petals small, white; sample on left is completely glabrous (subspecies crassicaulis), two on right are glandular in inflorescence (subspecies maxima); seeds from left plant in packet appear pebbled and grooved on back, but perhaps not fully formed",Sagina maxima subsp. maxima by Frank Lomer 2014,,,,NA,,NA,,,,NA,,,,,,,Yes,Yes,flomer1,,,,V241911
51,V191356,,,Caryophyllaceae,Sagina procumbens,Sagina,,procumbens,L.,,,,,NA,NA,NA,Canada,British Columbia,"Capital Regional District, Gulf of Georgia, Galiano Island, west of Stockade Hill, overlooking Montague Harbour",48,53,NA,-122,23,NA,48.883333,-122.383333,Unknown,NA,Verbatim from Collector/Sheet,David Rowswell,2018,,,Grid: 723146-720143 (92 b/14),"mesic, rocky roadbed edge under Douglas-fir - red cedar",,1986 Aug 16,William J. Crins,,7338,William J. Crins,1986,abundant,Sagina procumbens by William J. Crins 1986,STET Jamie D. Fenneman 2014,,,NA,,NA,,,,NA,,,,,,,,Yes,pcb2,,,,V191356
95,V231297,,,Rosaceae,Sanguisorba minor ssp. muricata,Sanguisorba,,minor,Scop.,muricata,(Bonnier & Layens) Briq.,,,NA,NA,NA,Canada,British Columbia,"Galiano Island, southwest end, south of Montague Harbour, 524 Clanton Road",48,53,38,-123,23,19,48.893889,-123.388611,Unknown,NA,Verbatim from Collector/Sheet,David Rowswell,2018,,,,"Roadside shoulder near creek, with Plantago lanceolata",60 m,2003 May 01,Frank Lomer,,4721,Frank Lomer,2003,"Introduced weed.,",Sanguisorba minor subsp. muricata by Frank Lomer 2003,,,,NA,,NA,,,,NA,,,,,,,,,,,,,V231297
56,V191361,,,Selaginellaceae,Selaginella wallacei,Selaginella,,wallacei,Hieron.,,,,,NA,NA,NA,Canada,British Columbia,"Capital Regional District, Gulf of Georgia, Galiano Island, west of Stockade Hill, overlooking Montague Harbour",48,53,NA,-122,23,NA,48.883333,-122.383333,Unknown,NA,Verbatim from Collector/Sheet,David Rowswell,2018,,,Grid: 723146-720143 (92 b/14),"dry, open, rock outcrop under by Douglas-fir - madrone forest",,1986 Aug 17,William J. Crins,,7343,William J. Crins,,common,,,,,NA,,NA,,,,NA,,,,,,,,,,,,,V191361
27,V178684,,,Asteraceae,Senecio sylvaticus,Senecio,,sylvaticus,L.,,,,,NA,NA,NA,Canada,British Columbia,"Gulf of Georgia, southeast end of Galiano Island, Stick Allen road",48,55,NA,-123,25,NA,48.916667,-123.416667,Unknown,NA,Verbatim from Collector/Sheet,David Rowswell,2018,,,,Weedy area along roadside,,1983 May 01,Gerald B. Straley,,2563,Gerald B. Straley,1983,,Senecio sylvaticus by Gerald B. Straley 1983,,,,NA,,NA,,,,NA,,,,,,,Yes,,,2008 - Dr. Gerald Straley's historical collection of the flora of B.C. digitization project (Irving K. Barber Learning Centre),,,V178684
40,V190909,,,Asteraceae,Senecio sylvaticus,Senecio,,sylvaticus,L.,,,,,NA,NA,NA,Canada,British Columbia,"Capital Regional District, Gulf of Georgia, Galiano Island, west of Stockade Hill, overlooking Montague Harbour",48,53,NA,-122,23,NA,48.883333,-122.383333,Unknown,NA,Verbatim from Collector/Sheet,David Rowswell,2018,,,Grid: 723146-720143 (92 b/14),"dry mesic, partially shaded roadbed under Douglas-fir - Red cedar",,1986 Aug 16,William J. Crins,,7340,William J. Crins,1986,uncommon,Senecio sylvaticus by William J. Crins 1986,,,,NA,"University of Toronto-Erindale(TRTE) Ontario, Canada",NA,,,,NA,,,,,,,,,,,,,V190909
70,V197705,,,Elaeagnaceae,Shepherdia canadensis,Shepherdia,,canadensis,(L.) Nutt.,,,,,NA,NA,NA,Canada,British Columbia,"Gulf of Georgia, Galiano Island, Montague Harbour",NA,NA,NA,NA,NA,NA,NA,NA,,NA,,,NA,,,,growing in edges of forest just above high tide,,1989 Apr 06,Gerald B. Straley,K. Wilf Nicholls,5280,"Gerald B. Straley, K. Wilf Nicholls",1989,common deciduous shrub ca. 2m tall,"Shepherdia canadensis by Gerald B. Straley, K. Wilf Nicholls 1989",,,,NA,,NA,,,,NA,,,,,,,Yes,,,2008 - Dr. Gerald Straley's historical collection of the flora of B.C. digitization project (Irving K. Barber Learning Centre),,,V197705
61,V191772,,,Rubiaceae,Sherardia arvensis,Sherardia,,arvensis,L.,,,,,NA,NA,NA,Canada,British Columbia,"southern Galiano Island, along Burrill Road",NA,NA,NA,NA,NA,NA,NA,NA,,NA,,,NA,,,,grassy roadside,,1987 May 02,Gerald B. Straley,,4147,Gerald B. Straley,1987,,Sherardia arvensis by Gerald B. Straley 1987,,,,NA,,NA,,,,NA,,,,,,,Yes,,,2008 - Dr. Gerald Straley's historical collection of the flora of B.C. digitization project (Irving K. Barber Learning Centre),,,V191772
128,V245145,,,Caryophyllaceae,Stellaria media,Stellaria,,media,(L.) Vill.,,,,,NA,NA,NA,Canada,British Columbia,"Galiano Island, Bellhouse Park",48.871823,NA,NA,-123.310643,NA,NA,48.871823,-123.310643,Unknown,NA,Verbatim from Collector/Sheet,David Rowswell,2018,,,,Woodland herbaceous community,,2016 Feb 12,Andrew Simon,,V-04,Andrew Simon,2016,,Stellaria media by Andrew Simon 2016,,,,NA,,NA,,,,NA,,,,,,,,Yes,AndrewSimon2016,,,,V245145
28,V178685,,,Caryophyllaceae,Stellaria nitens,Stellaria,,nitens,Nutt.,,,,,NA,NA,NA,Canada,British Columbia,"Gulf of Georgia, southeast end of Galiano Island, just off Stick Allison Road",48,55,NA,-123,25,NA,48.916667,-123.416667,Unknown,NA,Verbatim from Collector/Sheet,David Rowswell,2018,,,,Wet mossy areas above sea,,1983 May 01,Gerald B. Straley,,2561,Gerald B. Straley,1983,,Stellaria nitens by Gerald B. Straley 1983,,,,NA,,NA,,,,NA,,,,,,,Yes,,S nitens C,2008 - Dr. Gerald Straley's historical collection of the flora of B.C. digitization project (Irving K. Barber Learning Centre),,,V178685
172,V252566,6/23/2022,,Caryophyllaceae,Stellaria nitens,Stellaria,,nitens,Nutt.,,,,,NA,NA,NA,Canada,British Columbia,"Galiano Island, Haulback Road, District Lot 14",48.90664903,NA,NA,-123.3583117,NA,NA,48.90664903,-123.3583117,Unknown,NA,Verbatim from Collector/Sheet,Erika Brauner,2022,,,,Coastal herbaceous community,5 m,2017 Apr 20,Andrew Simon,,V-49,Andrew Simon,2017,,Stellaria nitens by Andrew Simon  2017,,,,NA,,NA,,,,NA,,,,,,,,Yes,ASimon2017,,,,V252566
173,V252567,6/23/2022,,Asteraceae,Taraxacum lacistophyllum,Taraxacum,,lacistophyllum,(Dahlst.) Raunk.,,,,,NA,NA,NA,Canada,British Columbia,"Galiano Island, Mount Sutil",48.869189,NA,NA,-123.378743,NA,NA,48.869189,-123.378743,Unknown,NA,Verbatim from Collector/Sheet,Erika Brauner,2022,,,,Open woodland herbaceous community,250 m,2017 Apr 23,Andrew Simon,,V-50,Curtis R. Bjork,2017,,Taraxacum lacistophyllum by Curtis R. Bjork  2017,,,,NA,,NA,,,,NA,,,,,,,,Yes,ASimon2017,,,,V252567
188,V252582,6/23/2022,,Brassicaceae,Thlaspi arvense,Thlaspi,,arvense,L.,,,,,NA,NA,NA,Canada,British Columbia,"Galiano Island, District Lot 57",48.92866032,NA,NA,-123.4679604,NA,NA,48.92866032,-123.4679604,Unknown,NA,Verbatim from Collector/Sheet,Erika Brauner,2022,,,,"Ruderal, roadside",60 m,2017 May 14,Andrew Simon,,V-68,Andrew Simon,2017,,Thlaspi arvense by Andrew Simon  2017,,,,NA,,NA,,,,NA,,,,,,,,Yes,ASimon2017,,,,V252582
99,V233785,,,Brassicaceae,Thysanocarpus curvipes,Thysanocarpus,,curvipes,Hook.,,,,,NA,NA,NA,Canada,British Columbia,"Galiano Island, Bodega Ridge, 30 m west of ridge top path at end of Cottage Way",48,57,25,-123,31,48,48.956944,-123.53,Unknown,NA,Verbatim from Collector/Sheet,David Rowswell,2018,,,,"40% southwest-facing slope; moist mossy site with Daucus pusillus, Saxifraga ferruginea, Mimulus alsinoides",190 m,1998 Apr 10,Frank Lomer,,98-3,Frank Lomer,1998,Ca. 50 plants; erect annual with tiny white flowers,Thysanocarpus curvipes by Frank Lomer 1998 1998,,,,NA,,NA,,,,NA,,,,,,,,,,,,,V233785
101,V234967,,,Brassicaceae,Thysanocarpus curvipes,Thysanocarpus,,curvipes,Hook.,,,,,NA,NA,NA,Canada,British Columbia,"Georgia Strait, Mount Galiano, southwest end of Galiano Island",48,51,48.5,-123,21,46.5,48.863472,-123.362917,Unknown,NA,Verbatim from Collector/Sheet,David Rowswell,2018,,,,"Mossy open southwest-facing slope near summit in drier sites, with Cynosurus echinatus, Arabis glabra, Clarkia amoena",275 m,2001 Apr 11,Frank Lomer,,3945,Frank Lomer,2001,Population = ca. 100; scarce in area,Thysanocarpus curvipes by Frank Lomer 2001,,,,NA,,NA,,,,NA,,,,,,,,,,,,,V234967
141,V245158,,,Apiaceae,Torilis japonica,Torilis,,japonica,(Houtt.) DC.,,,,,NA,NA,NA,Canada,British Columbia,"Galiano Island, Tapovan Peace Park",48.867549,NA,NA,-123.338528,NA,NA,48.867549,-123.338528,Unknown,NA,Verbatim from Collector/Sheet,David Rowswell,2018,,,,Inland cliff/woodland,,2016 May 30,Andrew Simon,,V-17,Andrew Simon,2016,,Torilis japonica by Andrew Simon 2016,,,,NA,,NA,,,,NA,,,,,,,,Yes,AndrewSimon2016,,,,V245158
240,V252636,6/23/2022,,Apiaceae,Torilis japonica,Torilis,,japonica,(Houtt.) DC.,,,,,NA,NA,NA,Canada,British Columbia,"Galiano Island, Mount Sutil",48.87046,NA,NA,-123.38213,NA,NA,48.87046,-123.38213,Unknown,NA,Verbatim from Collector/Sheet,Erika Brauner,2022,,,,"Herbaceous slope, southwest aspect",190 m,2017 Jun 14,Andrew Simon,,V-140,Andrew Simon,2017,,Torilis japonica by Andrew Simon  2017,,,,NA,,NA,,,,NA,,,,,,,,Yes,ASimon2017,,,,V252636
117,V241916,,,Anacardiaceae,Toxicodendron diversilobum,Toxicodendron,,diversilobum,(Torr. & A. Gray) Greene,,,,,NA,NA,NA,Canada,British Columbia,"Galiano Island, seaside cliff 650 m due southwest of junction of Poirlier Pass Road and McClure Road",48,55,36.1,-123,28,7.5,48.926694,-123.46875,NAD 83.00,NA,Verbatim from Collector/Sheet,David Rowswell,2018,,10U 465664 5419412,,"Top of granite/sandstone cliff with arbutus and Douglas-fir, associated with Lonicera hispidula",50 m,2014 May 14,Frank Lomer,,8705,Frank Lomer,2014,"growing in vertical cracks for 7 m and lying flat to the rock surface, flower buds not yet open except for the sunniest sites, a few plants scattered at the cliff top",Toxicodendron diversilobum by Frank Lomer 2014,,,,NA,,NA,,,,NA,,,,,,,Yes,Yes,flomer1,,,,V241916
119,V241918,,,Anacardiaceae,Toxicodendron diversilobum,Toxicodendron,,diversilobum,(Torr. & A. Gray) Greene,,,,,NA,NA,NA,Canada,British Columbia,"Galiano Island, seaside cliff 700 m due southwest of junction of Poirlier Pass Road and McClure Road",48,55,35.9,-123,28,9.6,48.926639,-123.469333,NAD 83.00,NA,Verbatim from Collector/Sheet,David Rowswell,2018,,10U 465623 5419406,,"Near seashore among boulders at cliff base with Douglas-fir and arbutus; growing with Lonicera hispidula, Prunus emarginata, Holodiscus discolor",20 m,2014 May 14,Frank Lomer,,8707,Frank Lomer,2014,"several plants in the area, mostly on south-facing rock faces; mostly in flower bud, but a few plants in full sun with abundant open flowers attracting many honeybees",Toxicodendron diversilobum by Frank Lomer 2014,,,,NA,,NA,,,,NA,,,,,,,Yes,Yes,flomer1,,,,V241918
103,V234969,,,Fabaceae,Trifolium microcephalum,Trifolium,,microcephalum,Pursh,,,,,NA,NA,NA,Canada,British Columbia,"Georgia Strait, Mount Galiano, southwest end of Galiano Island",48,51,48.5,-123,21,46.5,48.863472,-123.362917,Unknown,NA,Verbatim from Collector/Sheet,David Rowswell,2018,,,,Mossy open slope near summit,275 m,2001 Apr 11,Frank Lomer,,3947,Frank Lomer,2001,Annual with pinkish flowers and hairy calyx; common,Trifolium microcephalum by Frank Lomer 2001,,,,NA,,NA,,,,NA,,,,,,,,,,,,,V234969
212,V252608,6/23/2022,,Fabaceae,Trifolium microcephalum,Trifolium,,microcephalum,Pursh,,,,,NA,NA,NA,Canada,British Columbia,"Galiano Island, Bluffs Park",48.86701557,NA,NA,-123.337605,NA,NA,48.86701557,-123.337605,Unknown,NA,Verbatim from Collector/Sheet,Erika Brauner,2022,,,,South-facing herbaceous slope,115 m,2017 May 29,Andrew Simon,Alexander J. Wright,V-97,Andrew Simon,2017,,Trifolium microcephalum by Andrew Simon  2017,,,,NA,,NA,,,,NA,,,,,,,,Yes,ASimon2017,,,,V252608
213,V252609,6/23/2022,,Fabaceae,Trifolium microdon,Trifolium,,microdon,Hook. & Arn.,,,,,NA,NA,NA,Canada,British Columbia,"Galiano Island, Bluffs Park",48.86701557,NA,NA,-123.337605,NA,NA,48.86701557,-123.337605,Unknown,NA,Verbatim from Collector/Sheet,Erika Brauner,2022,,,,Rock outcrop herbaceous community,115 m,2017 May 29,Andrew Simon,Alexander J. Wright,V-98,Andrew Simon,2017,,Trifolium microdon by Andrew Simon  2017,,,,NA,,NA,,,,NA,,,,,,,,Yes,ASimon2017,,,,V252609
60,V191751,,,Fabaceae,Trifolium subterraneum,Trifolium,,subterraneum,L.,,,,,NA,NA,NA,Canada,British Columbia,"Gulf Islands, Galiano Island, southern Galiano Island, Burrell Road",NA,NA,NA,NA,NA,NA,NA,NA,,NA,,,NA,,,,grassy roadside,,1987 May 02,Gerald B. Straley,,4146,Gerald B. Straley,1987,,Trifolium subterraneum by Gerald B. Straley 1987,,,,NA,,NA,,,,NA,,,,,,,Yes,,,2008 - Dr. Gerald Straley's historical collection of the flora of B.C. digitization project (Irving K. Barber Learning Centre),,,V191751
